text,label,label_text
i need urgent help. i realize i sent my payment to the wrong account number. i made a typo. please cancel the transfer now. there isn't an option from the app.,8,cancel_transfer
i need urgent help. i realize i sent my payment to the wrong account number. i made a typo. please cancel the transfer immediately. i cannot do anything from the app.,8,cancel_transfer
when will the transaction go through?,45,pending_card_payment
card payment didn't go through.,25,declined_card_payment
i do not know what this charge is for,28,direct_debit_payment_not_recognised
how long does it take for money to transfer as my balance hasn't been updated,5,balance_not_updated_after_bank_transfer
i  see an extra 1£ charge on my app. why did it charge me extra?,34,extra_charge_on_statement
i don't have my card after 1 week. what are my next steps?,11,card_arrival
i have a cash withdrawal that i don't recognize.,20,cash_withdrawal_not_recognised
i have a top-up that's still pending and wanted to know about it.,47,pending_top_up
there is some cash that is showing up on my app.,20,cash_withdrawal_not_recognised
i cannot make a transfer to another account.,7,beneficiary_not_allowed
i want to cancel a purchase,52,request_refund
why didn't my payment process,45,pending_card_payment
i am angry that i got charged for using my card.,15,card_payment_fee_charged
i need to find out why my pending payment hasn't gone through.,45,pending_card_payment
after i used my card i saw i was charged a fee for using it,15,card_payment_fee_charged
there was a strange transaction made on my account a couple weeks ago by a seller i don't recognize. may you please check on this transaction for me.,28,direct_debit_payment_not_recognised
i am having trouble transferring money to a beneficiery.,7,beneficiary_not_allowed
i found a transfer fee - is that correct?,64,transfer_fee_charged
"i was trying to make a transfer and got an error message telling me it was not possible to make the transfer. this has never happened before, what happened?",7,beneficiary_not_allowed
"i'm not sure why my payment has been declined? please tell me why, i thought it was all good.",25,declined_card_payment
i've made a transfer from france two days ago but i was wondering if international transfers take longer to arrive because it hasn't made it yet.,5,balance_not_updated_after_bank_transfer
"|i moved out of my old house two weeks ago and cancelled my direct debit to my old landlord, this direct debit was working fine.  now i've moved in to a new place and set up a transfer to a new landlord but it's not reached her yet, can you check it please?",66,transfer_not_received_by_recipient
hello. can you help figure out why the recent transfer from my uk bank account isn't showing up?,5,balance_not_updated_after_bank_transfer
i purchased this item and would like a refund,52,request_refund
i was overcharged one extra pound!,34,extra_charge_on_statement
"one of my card payments, i don't recognise the name of the merchant.",16,card_payment_not_recognised
i need to do a card activation.,0,activate_my_card
i couldn't get the money i needed.,75,wrong_amount_of_cash_received
i am still waiting on my card?,11,card_arrival
my app shows a money withdrawal that i did not do.,20,cash_withdrawal_not_recognised
why hasn't my top-up gone through?,47,pending_top_up
"i ordered something, and now i have buyer's remorse. since what i ordered hasn't come yet, can you just cancel the payment since i already know i want a refund for it?",52,request_refund
why can't the recepient of my money transaction see it?,66,transfer_not_received_by_recipient
"hey, i ordered a thing but changed my mind and want a refund on it. since i haven't received the thing, would you just go ahead and cancel the payment for me?",52,request_refund
why did you charge a fee when i withdrew from an atm?,19,cash_withdrawal_charge
how do i return something for a full refund?,52,request_refund
"i just got my new card, how do i activate it?",0,activate_my_card
i did a money transaction and the recipient doesn't see it,66,transfer_not_received_by_recipient
my balance didn't change after i transferred some money.,5,balance_not_updated_after_bank_transfer
there's a payment with my card that i definitely didn't create. i don't know anyone by that name.,16,card_payment_not_recognised
after i transferred money the balance remained the same.,5,balance_not_updated_after_bank_transfer
could i get tracking on the card?,11,card_arrival
"i performed a transfer within the country the day before yesterday, but it has not gone through? can you check on that? the account number is definitely correct, as i've checked.",66,transfer_not_received_by_recipient
"i only made one transaction at this place, but it's appearing multiple times.",63,transaction_charged_twice
there is a payment in the app i did not make,16,card_payment_not_recognised
why was i not able to take cash from the atm?,26,declined_cash_withdrawal
is there a problem that makes my payments show pending?,45,pending_card_payment
help! i think someone has made a cash withdrawal with my card!,20,cash_withdrawal_not_recognised
"as advised by you, i requested seller to refund my money. a week has passed but i haven't got any update from seller. please track the refund with the seller.",51,Refund_not_showing_up
there are funds in my app that i did not receive.,20,cash_withdrawal_not_recognised
"a few weeks ago, a strange transaction was made on my account by a seller i don't know. i am quite sure i didn't do it and will like for you to check it for me.",28,direct_debit_payment_not_recognised
"while transferring money, its getting error out as my transfer is not possible. please help me in this as earlier i was able to do it successfully.",7,beneficiary_not_allowed
i was only given $20 when i tried to get $100,75,wrong_amount_of_cash_received
hello i changed my mind and really need a refund on something i bought recently. can you please cancel the transaction and get me my money back. please it's urgent.,52,request_refund
is my card ready for use or does it need activated and if so how?,0,activate_my_card
help! in the app there is a payment that i don't remember.,16,card_payment_not_recognised
i am having an issue with an in country transfer i did a few days ago. it has yet to appear in my account. i have checked to be sure that all account information is correct multiple times. what is taking the transfer so long?,66,transfer_not_received_by_recipient
"i keep checking to see if i've received a refund that i requested from a seller, but i'm not seeing the refund. i need you to help me get the refund.",51,Refund_not_showing_up
i have multiple of the same transaction,63,transaction_charged_twice
why is the exchange rate different from what i expected?,17,card_payment_wrong_exchange_rate
i see a charge for a direct debit that was not me.,28,direct_debit_payment_not_recognised
"i no longer want to transfer funds, can we cancel that transaction?",8,cancel_transfer
my app statement shows i took out cash from an atm but i did not. what can i do?,20,cash_withdrawal_not_recognised
i'm sure i have enough money so why didn't the store accept my card?,25,declined_card_payment
why was the exchange rate so wrong when i bought something!,17,card_payment_wrong_exchange_rate
my new card hasn't came in.,11,card_arrival
i want my card frozen right away. money was taken out in an odd location i have never heard of.,20,cash_withdrawal_not_recognised
i transferred some money but the balance stayed the same.,5,balance_not_updated_after_bank_transfer
"hi, i sent a payment to the wrong account number - can you cancel it as soon as possible?",8,cancel_transfer
"i did a cash deposit to my account, but i am not seeing it on my statement.",6,balance_not_updated_after_cheque_or_cash_deposit
"i made a rent payment from the wrong account yesterday. it absolutely has to go through tomorrow, so can you please reroute the payment to the right account?",8,cancel_transfer
i haven't gotten my credit card in the mail.,11,card_arrival
"i made a mistake when sending a payment, sending it to the wrong account number (with a typo) - can you please cancel the transaction?",8,cancel_transfer
i wish to cancel a transfer,8,cancel_transfer
there was a charge applied when i used my card.,15,card_payment_fee_charged
i would like my money back for an item i purchased,52,request_refund
i did not charge my account for that transaction.  that's an error.,16,card_payment_not_recognised
i didn't make a payment at this business.,16,card_payment_not_recognised
a payment is pending,45,pending_card_payment
there's a payment that isn't mine on my app,16,card_payment_not_recognised
why did i get charged for withdrawing cash?,19,cash_withdrawal_charge
why did my account decline a incoming transfer,7,beneficiary_not_allowed
i see a strange payment in my account.,16,card_payment_not_recognised
please help me with my card. as i have tried to use my card in two different atms but repeatedly it was declining by atm.,26,declined_cash_withdrawal
who do i call to cancel a transfer?,8,cancel_transfer
how do i activate a card?,0,activate_my_card
why was the payment on my card declined?,25,declined_card_payment
"hello, i made a payment with my card and it's not working. it's been a while and still says its pending. can you tell when this will go through?",45,pending_card_payment
what is the reason my payment was not accepted?,25,declined_card_payment
what happens if my card payment is cancelled?,53,reverted_card_payment?
i was not distributed all of cash that i requested,75,wrong_amount_of_cash_received
"i have received my statement but i do not see my refund, why is that?",51,Refund_not_showing_up
why was i charged for making a withdrawal? after i went grocery shopping i withdrew some money from my account and now there is another charge.,19,cash_withdrawal_charge
why isn't my money from a check deposit showing?,6,balance_not_updated_after_cheque_or_cash_deposit
"there was an extra fee when i paid with my card, why was i charged this extra fee?",15,card_payment_fee_charged
how do i check to see why my card payment was declined?,25,declined_card_payment
does the exchange rate change each day for purchases? there is a different rate on my purchase.,17,card_payment_wrong_exchange_rate
where is my unknown payment from?,16,card_payment_not_recognised
i need to freeze my card as soon as possible. i just checked my account and saw that there have been several payments that i don't recognize over the course of a few days. can we investigate and get my money back?,16,card_payment_not_recognised
i tried pulling out money at the atm and it gave me an incorrect amount back.,75,wrong_amount_of_cash_received
wheres my money receipt,66,transfer_not_received_by_recipient
my refund is still pending,51,Refund_not_showing_up
the exchange rate i was charged for a purchase was not right.,17,card_payment_wrong_exchange_rate
"some cash was withdrawn in the app, but i did not do it.",20,cash_withdrawal_not_recognised
i am not able to make a purchase because there is an issue with my card,53,reverted_card_payment?
"i was transferring some money to a friend, which i thought would be free, but i see there is a charge.  what's up with that?",64,transfer_fee_charged
when i went to withdraw cash today the atm gave me the wrong amount of cash. the app is showing a larger amount.,75,wrong_amount_of_cash_received
i placed a cash deposit in my account but i can't see it yet.,6,balance_not_updated_after_cheque_or_cash_deposit
how long before transferred money shows up?,5,balance_not_updated_after_bank_transfer
why will my transfer not go through?!  keep getting an error message.,7,beneficiary_not_allowed
"hello, i wanted to get some more information about atm withdraw fee. i have been withdrawing money for years and notice this charge on my account. i always thought it was no fee since its you guys atm company that i am withdrawing. can you please explain?",19,cash_withdrawal_charge
"hurry and refund me, i am waiting",51,Refund_not_showing_up
why hasn't my in country transfer gone through yet? i confirmed the account info a couple days ago but the payment hasn't been posted yet.,66,transfer_not_received_by_recipient
how do i activate my card so i can start using it?,0,activate_my_card
what is the extra fee that showed up on my card?,15,card_payment_fee_charged
"i shouldn't have been charged but i see a fee, why?",15,card_payment_fee_charged
how long does a transfer from the united kingdom take? i haven't seen it show up yet in my bank account and want to make sure i get the transfer.,5,balance_not_updated_after_bank_transfer
my bill shows the same charge more than once,63,transaction_charged_twice
why do i see a random withdrawal in my app?,20,cash_withdrawal_not_recognised
what are the reasons why you would not be able to process a payment,7,beneficiary_not_allowed
"is something wrong with my account, my balance didn't change after i transferred some money",5,balance_not_updated_after_bank_transfer
i'm not recognizing the card payment.,16,card_payment_not_recognised
if i make a mistake can i cancel the transaction?,8,cancel_transfer
i don't understand why i was charged extra for withdrawing money?,19,cash_withdrawal_charge
how long are my top ups pending,47,pending_top_up
"i transferred a payment a couple days ago and it shows done, but it has not been received.  could you please help me?",66,transfer_not_received_by_recipient
"do you charge for cash withdrawals?  i want to get my hands on my own money and you appear to be charging me for the pleasure! why is this, you'd never get this with my high street bank!",19,cash_withdrawal_charge
"hi, i was looking over my card receipts for the past week and i realize i had a charge put through two times for the same single restaurant visit. can one of the charges be removed so that i can get the money back that was mistakenly taken from my account?",63,transaction_charged_twice
"hello, i just checked my statement and there seems to be a payment from my card that i have never seen before.",16,card_payment_not_recognised
"my cash withdrawal was declined, why?",26,declined_cash_withdrawal
why didn't i receive the correct exchange rate for an item that i purchased?,17,card_payment_wrong_exchange_rate
where did the  €1 fee in my statement come from,34,extra_charge_on_statement
why hasn't my refund been appiled to my account?,51,Refund_not_showing_up
"i seem to have a problem here, i bought something about a 2 weeks ago and just now received the payment back into my account and i've already received the item. can you tell me what is going on here?",53,reverted_card_payment?
i might need a new card because it's not working at any of the atms. i don't think ive used all my money. why is it doing this?,26,declined_cash_withdrawal
there was a charge made on my card from a couple weeks ago and i don't remember making the purchase. nor do i remember the company itself. can we trace this at all to confirm if i did it or not?,28,direct_debit_payment_not_recognised
the currency exchange rate was wrong for a purchase i made.,17,card_payment_wrong_exchange_rate
why  am i being told this  transfer will not  go thru,7,beneficiary_not_allowed
how do i go about getting a refund?,52,request_refund
exchange rate on a purchase was incorrect,17,card_payment_wrong_exchange_rate
my card payment has had the status of pending forever. what is the issue? it should have gone through at some point.,45,pending_card_payment
i messed up and made a transaction using the wrong account.,8,cancel_transfer
i attempted to withdraw some money from an atm this morning and received the wrong amount. your app says i have enough money available in the account. can someone tell me what's wrong?,75,wrong_amount_of_cash_received
i thought transfers were free. why was i charged to transfer?,64,transfer_fee_charged
why isn't my top-up going through?,47,pending_top_up
"help! i'm missing money, i deposited a cheque but its not showing on my balance.",6,balance_not_updated_after_cheque_or_cash_deposit
what is the word?,28,direct_debit_payment_not_recognised
i keep checking my statements but nothing shows up.i requested a refund a long time ago but seems like it's not submitting my account for some reason. can you please help me get the money back from the seller for me,51,Refund_not_showing_up
i haven't received my order and want a refund,52,request_refund
why did i only get $20 when i asked for $100?,75,wrong_amount_of_cash_received
i just had my card get declined at the atm! i need to get money out but i am unable to.  why has this happened?,26,declined_cash_withdrawal
the cheque i deposited isn't showing in my account,6,balance_not_updated_after_cheque_or_cash_deposit
how do i find the refund on my statement?,51,Refund_not_showing_up
i'm expecting a refund but it's no where to be seen,51,Refund_not_showing_up
how come i was charged a transaction of $1?,34,extra_charge_on_statement
the atm is showing it gave me the money i requested but i didn't get that amount.,75,wrong_amount_of_cash_received
why am i still not able to see the money i deposited a week ago? this is urgent!!,6,balance_not_updated_after_cheque_or_cash_deposit
this card payment isn't is recognition.,16,card_payment_not_recognised
i just made a top-up but it shows as pending! i use your service all the time and have never had a problem before. why does it keep showing up as pending?,47,pending_top_up
"my transfer was wrong, are you able to stop it before it goes through please?",8,cancel_transfer
how can i verify if a cash withdrawal was made from my account? i still have my card with me but i did not authorize the withdrawal that just occurred.,20,cash_withdrawal_not_recognised
one of my payments was doubled,63,transaction_charged_twice
how do i activate my card,0,activate_my_card
my latest transfer seems to be missing.,5,balance_not_updated_after_bank_transfer
is there a reason my new card hasn't arrived?,11,card_arrival
my statement shows and extra 1$ that was charged to it and i would like to know why.,34,extra_charge_on_statement
why are fees charged for cash withdrawals? i went to withdraw some money earlier today after shopping. there's a new fee that there.,19,cash_withdrawal_charge
i would like to cancel my purchase.,52,request_refund
my card wasn't working in a shop,25,declined_card_payment
why was i charged an extra pound?,34,extra_charge_on_statement
i am confused why there is cash i did not accept in my account,20,cash_withdrawal_not_recognised
why can't i transfer to another account?,7,beneficiary_not_allowed
"i don't want to buy this car anymore, can i cancel the transaction and get a quick refund back?",52,request_refund
"i know this very late, but i just went through my statements from the last couple months and there's one quite large-ish payment that i definitely haven't made. is it still possible to dispute it?",28,direct_debit_payment_not_recognised
there is a debit paymet that i don't recognize.,28,direct_debit_payment_not_recognised
card payment is showing as pending,45,pending_card_payment
why hasn't my balance been updated? i've deposited a few cheques some days ago!,6,balance_not_updated_after_cheque_or_cash_deposit
there is a debit i dont recognize,28,direct_debit_payment_not_recognised
i am so angry right now!  i went to the atm and did not get the correct amount of money i chose to withdraw.  how could this happen?  i need my money and want to know how i can get it asap!,75,wrong_amount_of_cash_received
what should i do if i see an unauthorized withdrawal on my statement?,20,cash_withdrawal_not_recognised
can i withdraw money in my hometown currency while on holiday without any additional fees?,76,wrong_exchange_rate_for_cash_withdrawal
"i accidentally entered in my retailers information, what should i do next",66,transfer_not_received_by_recipient
can i use my new card?,0,activate_my_card
"hello. please, would you tell me if you have or have not received funds for a refund that i recently requested for a big purchase? i've contacted the merchant, but i can't tell that they have taken any action on it.",51,Refund_not_showing_up
my balance doesn't include my latest transfer,5,balance_not_updated_after_bank_transfer
i went to the notting hill atm to use my card the first time for a cash withdrawal but it didn't work. does this mean that my card isn't working yet?,26,declined_cash_withdrawal
the atm shows a withdraw of the amount of money i requested but i didn't revieve that amount in cash.,75,wrong_amount_of_cash_received
why hasn't my friend received the transaction?,66,transfer_not_received_by_recipient
"hi, would you please activate my card?",0,activate_my_card
"would you please check my card. as withdrawal was working fine so far, but this morning suddenly got declined. can you please check the problem?",26,declined_cash_withdrawal
i need to stop a transaction that i made.,8,cancel_transfer
why can't i see a transfer to my account?,5,balance_not_updated_after_bank_transfer
i transferred money and it didn't get there.,66,transfer_not_received_by_recipient
why did you charge me extra when i withdrew cash?,19,cash_withdrawal_charge
"i tried transferring money to a beneficiary, however, i was unsuccessful.",7,beneficiary_not_allowed
i need to cancel my card.  there are a few charges from a couple days ago that i didn't make.  can i get credit for these charges?,16,card_payment_not_recognised
transaction refund missing from my statement.,51,Refund_not_showing_up
is there a fee for transferring money,64,transfer_fee_charged
"help me!  when i was abroad, the exchange rate was wrong.",76,wrong_exchange_rate_for_cash_withdrawal
i attempted to get cash in the atm but i was denied,26,declined_cash_withdrawal
it appears my top-up has not gone through.,47,pending_top_up
where can i activate my card?,0,activate_my_card
why did i get charged a fee on my card?,15,card_payment_fee_charged
what happens if the atm gives me the wrong amount of money?,75,wrong_amount_of_cash_received
can someone assist me with activating my card?,0,activate_my_card
under what condition will my payment revert?,53,reverted_card_payment?
can i get money back in my home currency at  atm? as i am on holiday and bit concerned because i do not have any cash with me . is it possible to withdraw without any additional cost.,76,wrong_exchange_rate_for_cash_withdrawal
what is this $1 charge on my account?,34,extra_charge_on_statement
why was i charged a fee for withdrawing money?,19,cash_withdrawal_charge
my top up is pending still,47,pending_top_up
i changed my mind on something i purchased through you and i need the transaction canceled and a refund as soon as possible. can you help me please?,52,request_refund
"i made a mistake on the last transfer i made, who must i speak with to cancel?",8,cancel_transfer
help my money isnt showing up,5,balance_not_updated_after_bank_transfer
i tried updating my balance by cheque yesterday but it doesn't seem to be working. shouldn't that be faster? please check my account something has gone wrong there.,6,balance_not_updated_after_cheque_or_cash_deposit
i was not distributed the correct amount of cash that i asked for,75,wrong_amount_of_cash_received
"i made a transfer and the receiver said they haven't actually received the right amount, but it's a bit less. now i have to transfer more money to make up for the missing bit. can you please alert me about this, what has been going on?",64,transfer_fee_charged
my money transaction can't be seen by the person i sent it to,66,transfer_not_received_by_recipient
the atm gave me less cash than requested,75,wrong_amount_of_cash_received
"i topped-up my account, but i don't think it went through.",47,pending_top_up
why is there a direct debit set up in my name?,28,direct_debit_payment_not_recognised
i attempted to deposit a cheque yesterday but the balance isn't showing today. is it still pending?,6,balance_not_updated_after_cheque_or_cash_deposit
i've been using my account while abroad for a while but only recently i've been charged a fee. why am i only being charged a fee now.,64,transfer_fee_charged
dude i put money in the atm last week but it ain't there! i need the money now figure this out!,6,balance_not_updated_after_cheque_or_cash_deposit
how can i activate my new card? i didn't recieve any information with it about how to do so.,0,activate_my_card
i am being charged a pound out of nowhere. what is this?,34,extra_charge_on_statement
i have a new card and i need to activate it.,0,activate_my_card
let me know when you charge extra for payments please. i just checked the app earlier when i saw that there was an additional fee on one of the payments that i wasn't warned about before.,15,card_payment_fee_charged
why cant i transfer to my account?,7,beneficiary_not_allowed
"my payment has been declined!! what's going on, i thought everything was alright and working well?",25,declined_card_payment
there is an odd payment in my statement,16,card_payment_not_recognised
why have i all of a sudden been charged for my atm withdrawal? i thought the withdrawals were free because this is the first time i've ever had this problem.,19,cash_withdrawal_charge
i got cash abroad and the exchange rate applied is wrong,76,wrong_exchange_rate_for_cash_withdrawal
how long does it take for a new purchase to stop being considered pending?,45,pending_card_payment
how long do i have to wait for my bank transfer to appear in my account?,5,balance_not_updated_after_bank_transfer
why does the same transaction appear multiple times?,63,transaction_charged_twice
can you explain the transfer fee that i was charged?,64,transfer_fee_charged
"i was suppose to be getting a refund for something i purchased a while ago, but it still hasnt been applied to my account. when will i get my money back?",51,Refund_not_showing_up
how long does it take to recieve my new card?,11,card_arrival
