text,label,label_text
"hi, i was checking my old statements and found a discrepancy with a large amount transaction. i am sure it was not done by me. please let me know if i could raise a dispute as its very late.",28,direct_debit_payment_not_recognised
"one of my charges was declined, but the second one went through.  but i notice on my app that one of them has gone through, and the other one is still pending.  please ensure that only one charge is processed. thanks",63,transaction_charged_twice
"if i found an error in my account for a transaction i didn't make, how long to i have to dispute it?",28,direct_debit_payment_not_recognised
what is the process to activate a card,0,activate_my_card
my card won't let me withdraw money.,26,declined_cash_withdrawal
why wont the atm give me cash?,26,declined_cash_withdrawal
"after i got my cash, i found out my exchange rate was wrong.",76,wrong_exchange_rate_for_cash_withdrawal
will i be charged for a cash withdrawal?,19,cash_withdrawal_charge
i transferred some cash and it didn't arrive,66,transfer_not_received_by_recipient
when did i get a $1 extra fee on my statement?,34,extra_charge_on_statement
"hello, i have recently made a purchase and have decided to cancel my purchase. is there any way that you can cancel that transaction for me so i can get the money back? it's very important.",52,request_refund
cash withdrawal was incorrect at atm.,75,wrong_amount_of_cash_received
"hi, i just looked at my card transactions and saw that i've been charged twice for a restaurant i went to this week. can you remove the double charge, please?",63,transaction_charged_twice
i needed $100 but all it gave me was $20.,75,wrong_amount_of_cash_received
"i looked at my statement, and there is a charge for 1£ that i don't recognize.  why is it on there?",34,extra_charge_on_statement
i was charged for getting cash.,19,cash_withdrawal_charge
"if i ordered my new card last week, how much longer should i wait to receive it?",11,card_arrival
i want a refund for an item,52,request_refund
i sent a cheque a few days ago and i noticed that no money has been put on my account. can you please tell me the situation of my account?,6,balance_not_updated_after_cheque_or_cash_deposit
"this morning i wanted to make a withdrawal before work, but my card was declined! please double check it for me as this is the first time it was declined.",26,declined_cash_withdrawal
i made a top up yesterday but it's still pending.,47,pending_top_up
i have transferred some money but the balance hasn't changed,5,balance_not_updated_after_bank_transfer
why can't i get cash from the atm?,26,declined_cash_withdrawal
i need to change a transfer.,8,cancel_transfer
"i need to activate my card, how is that done?",0,activate_my_card
tell me why my balance did not change when i tranferred cash.,5,balance_not_updated_after_bank_transfer
why hasn't my friend received the money i sent them yet?,66,transfer_not_received_by_recipient
"hi, i am interested buying crypto currency but unable to purchase it through the application. i do want to do the exchange, could you please let me know what is the problem?",7,beneficiary_not_allowed
the correct amount of cash was not received.,75,wrong_amount_of_cash_received
how long does a transfer from the uk account usually take? after completing the transfer it is not showing up. i need to know that everything i actually went okay.,5,balance_not_updated_after_bank_transfer
how can i track my card's delivery?,11,card_arrival
can you elaborate on why i have an extra charge just for transferring?,64,transfer_fee_charged
hey i thought transfers were free.  why are you charging me?,64,transfer_fee_charged
i have gone through my statements and noticed there is a large payment that i did not make. can i still dispute the payment? its been a while,28,direct_debit_payment_not_recognised
"i just saw the exchange rate you use, but it's so bad that i can't believe that it's the official interbank exchange rate! is this truly the official interbank exchange rate?",17,card_payment_wrong_exchange_rate
where do i go for a refund?,52,request_refund
"when i bought something abroad, the exchange rate was wrong.",17,card_payment_wrong_exchange_rate
a transaction on my card shows as pending.,45,pending_card_payment
there is a top up that has been pending for an hour and i don't know why.  i was expecting it immediately and need it now!,47,pending_top_up
why has my card payment not yet been applied to my account?,45,pending_card_payment
are you ripping people off with the exchange rate?  it can't be that atrocious between banks.,17,card_payment_wrong_exchange_rate
my card couldn't pay in a shop.,25,declined_card_payment
explain why my card payment wouldn't go through.,25,declined_card_payment
what was the extra charge for withdrawing money?,19,cash_withdrawal_charge
"i sent a cheque to you a few days ago and the deposit has yet to appear in my account. i need this money, what is the problem?",6,balance_not_updated_after_cheque_or_cash_deposit
why are all my card payments being declined?,25,declined_card_payment
how long does a bank transfer take to show up in available funds?,5,balance_not_updated_after_bank_transfer
"i was trying to use my card and it was declined, when i tried to find out what happened i found cash withdraw for $500 that i didn't do.  can you please help figure this out?",20,cash_withdrawal_not_recognised
my balance doesn't show my deposit.,6,balance_not_updated_after_cheque_or_cash_deposit
can you explain why the atm is giving me less money than what i asked for?,75,wrong_amount_of_cash_received
my refund is not here yet,51,Refund_not_showing_up
my card payment has been pending for a long time now. why is it taking so long to take. it should have already made it through.,45,pending_card_payment
i can't see the transfer that i put in.,5,balance_not_updated_after_bank_transfer
why am i seeing a direct debit thats not mine?,28,direct_debit_payment_not_recognised
can i have my money refunded for an item,52,request_refund
my transfer to a beneficiary was rejected.,7,beneficiary_not_allowed
what is taking so long with my refund?,51,Refund_not_showing_up
i bought something and want the money refunded can i get some help with that?,52,request_refund
how can i dispute a direct debit transaction?,28,direct_debit_payment_not_recognised
please cancel the transaction,8,cancel_transfer
this fee shouldn't be there after i paid with a card.,15,card_payment_fee_charged
"i went to the store and tried to make a purchase.  the first time, it was declined, but the second one went through.  but my app shows me that i've already been charged once and the second charge is still pending.  can you make sure that i'm not charged twice?",63,transaction_charged_twice
what should i do about a direct debit that i did not set up?,28,direct_debit_payment_not_recognised
i asked for a refund but its not here yet,51,Refund_not_showing_up
i sent money and the recipient has not received their money after two weeks.,66,transfer_not_received_by_recipient
there is a direct debit that looks suspicious.,28,direct_debit_payment_not_recognised
a payment i didn't do shows in my app,16,card_payment_not_recognised
i just had a look at my statement. why have i been changed for using the atm?,19,cash_withdrawal_charge
"i don't recognize this payment on my app, i am sure i didn't spend any money there.",16,card_payment_not_recognised
i set up a payment to a new payee and sent some money but the person i'm sending it to has not received it.  can you check where the money is?,66,transfer_not_received_by_recipient
i was wrongfully charged one pound.,34,extra_charge_on_statement
please tell me why the same transaction is showing up on my account more than once.,63,transaction_charged_twice
can i track my card while it is in the process of delivery?,11,card_arrival
hello i changed my mind and want a refund on one of things i bought recently. can you please cancel the transaction and get me my money back. please it's urgent.,52,request_refund
why am i unable to withdrawal cash?,26,declined_cash_withdrawal
"my new card is here, what's the process for activating it?",0,activate_my_card
tell me why my card payment would be reverted.,53,reverted_card_payment?
i wasn't applied the correct exchange rate when getting cash,76,wrong_exchange_rate_for_cash_withdrawal
how do i activate my new card,0,activate_my_card
what do i do to activate my new card?,0,activate_my_card
when i received my cash; they had my exchange rate incorrect.,76,wrong_exchange_rate_for_cash_withdrawal
what is wrong with my top-up?,47,pending_top_up
the exchange rate was different when i got cash,76,wrong_exchange_rate_for_cash_withdrawal
i cannot find my refund on my statement.,51,Refund_not_showing_up
why have i received a rebate for my payment after a week?,53,reverted_card_payment?
i made a bank transfer but it doesn't seem to have gone through?,5,balance_not_updated_after_bank_transfer
i sent a payment to the wrong account number - can that transaction be reversed? i am worried about accidentally giving my money away.,8,cancel_transfer
i wanted to withdraw $100 from the atm but i only got $20,75,wrong_amount_of_cash_received
"it seems my card payment was completed twice. i paid at the store previously and the first one did not seem to go through. after a second attempt, it did go through. i now see within the app that i have been charged twice with one of them pending. can you please remove the pending amount because it is clearly something that was declined?",63,transaction_charged_twice
there is a repeat charge for the same item,63,transaction_charged_twice
what is the reason for my beneficiary to be disallowed?,7,beneficiary_not_allowed
my purchases from this morning still have pending payments.,45,pending_card_payment
"the cheque i sent a few days ago has not been deposited yet, what is the hold up?",6,balance_not_updated_after_cheque_or_cash_deposit
i made a purchase and was charged at the wrong foreign exchange rate.,17,card_payment_wrong_exchange_rate
i made a payment with my card that was cancelled?,53,reverted_card_payment?
cash i did not get showed up in my account,20,cash_withdrawal_not_recognised
i have not received the completed transaction.,66,transfer_not_received_by_recipient
"the past few times i've been to the atm, i was charged a withdrawal fee. have your policies changed regarding fees?",19,cash_withdrawal_charge
an incorrect exchange rate was applied to an item i bought.,17,card_payment_wrong_exchange_rate
can you tell me why my card was declined?,25,declined_card_payment
why is there some cash that i did not deposit in my account?,20,cash_withdrawal_not_recognised
why is the purchase i made this morning still pending?,45,pending_card_payment
"i received a refund, however i cannot see it in my account",51,Refund_not_showing_up
what is this €1 charge?,34,extra_charge_on_statement
"even though i added money ey to the card, i couldn't use it",47,pending_top_up
the atm only gave me 10 pounds when i withdrew 30. what do i do?,75,wrong_amount_of_cash_received
i saw a payment come out of my account for a merchant i don't remember.,16,card_payment_not_recognised
my card is not working at stores.,25,declined_card_payment
tell me why there is a charge on my cash withdrawl.,19,cash_withdrawal_charge
i just realized i made the wrong transaction yesterday. would  you please make it correct?i need it by tomorrow please.,8,cancel_transfer
"hi, i am unable to use my card in atm. i had tried my card in two atms but both atms declined it. could you please check my account?",26,declined_cash_withdrawal
when does my balance update for a transfer,5,balance_not_updated_after_bank_transfer
i notice that i have a card payment that's been cancelled.,53,reverted_card_payment?
there is a strange payment on my card and i don't know what to do.,16,card_payment_not_recognised
i was the victim of someone stealing my wallet.  my card is being used and it isn't me.  what should i do?,20,cash_withdrawal_not_recognised
the atm did not give me as much cash as i requested.,75,wrong_amount_of_cash_received
what is the time for a transfer?,66,transfer_not_received_by_recipient
i went tot the atm earlier today and didn't realize this till now but i did not get all the money i requested.  i believe my account was charged for 100 but i only got 80.  is there any way we can solve this problem?,75,wrong_amount_of_cash_received
there are a couple of payments with my card shown in the app that i really didn't make myself. why is it happened?,16,card_payment_not_recognised
why isn't my deposit showing up?,6,balance_not_updated_after_cheque_or_cash_deposit
i did not ask for the amount of cash that i received.,75,wrong_amount_of_cash_received
why was my card declined in a shop?,25,declined_card_payment
i was supposed to get a refund but it is not showing up on my card,51,Refund_not_showing_up
"i made a transfer and according to the receiver ""they haven't received the right amount"" its lesser than it should be.now i have to transfer more money to make up for the missing amount . can you please help me about this,what should be done",64,transfer_fee_charged
i got an unexpected charge on my transfers. how can i correct this?,64,transfer_fee_charged
where is the money i put in the bank?,6,balance_not_updated_after_cheque_or_cash_deposit
i'm being charged for using my card!,15,card_payment_fee_charged
"i have checked the account information several times to be sure that it is correct, but the in country transfer i did a few days ago still has not appeared! what is the hold up?",66,transfer_not_received_by_recipient
my card payment has been stuck on pending. what is the problem? it should have gone through by now.,45,pending_card_payment
why does my statement have an extra fee?,34,extra_charge_on_statement
why am i being charged to make cash withdrawals? i thought they were supposed to be free!,19,cash_withdrawal_charge
i don't recognize what this payment on my statement would be for.,16,card_payment_not_recognised
can you please check my uk account to make sure everything went alright?  i made the transfer a couple of hours ago.,5,balance_not_updated_after_bank_transfer
how do i know when my new card is going to arrive?,11,card_arrival
the exchange rate for my payment last saturday must be wrong because i was charged extra.,17,card_payment_wrong_exchange_rate
i made a transfer to my friend earlier and she hasn't received it yet.  what's the hold up?,66,transfer_not_received_by_recipient
why isn't my balance updating?  i did a bank transfer and it isn't current.,5,balance_not_updated_after_bank_transfer
i need to cancel a transaction immediately.,8,cancel_transfer
my purchases from this morning are showing up as payment pending. can you tell me why?,45,pending_card_payment
foreign currency rates were put in wrong at an atm i used.,76,wrong_exchange_rate_for_cash_withdrawal
what do i do to activate?,0,activate_my_card
please explain why my top-up hasn't been processed yet?,47,pending_top_up
my statement has a payment that i do not recall making,16,card_payment_not_recognised
why am i seeing a transfer fee on my bank statement?,64,transfer_fee_charged
why was there a fee for paying by card?,15,card_payment_fee_charged
i wasn't charged the correct exchange rate for an item i purchased.,17,card_payment_wrong_exchange_rate
i tried to withdraw cash from the atm machine and it did not work. can you tell me why?,26,declined_cash_withdrawal
"i am using the app, and i see cash withdrawals that i did not authorize.",20,cash_withdrawal_not_recognised
why was i double charged?,63,transaction_charged_twice
i am unhappy with an item i bought. how do i get a refund?,52,request_refund
how long will it take for my top up to work? it's still pending,47,pending_top_up
what does it mean when it says i have a payment pending?,45,pending_card_payment
i made a transfer and was charged extra. why?,64,transfer_fee_charged
i made a purchase but the exchange rate is wrong?,17,card_payment_wrong_exchange_rate
the exchange rate for case abroad is applied wrong.,76,wrong_exchange_rate_for_cash_withdrawal
is it possible to get a refund?,52,request_refund
i just found out from the seller that my money didn't go through. i checked my account and it was deducted at first but now it's back in my account. can you  please fix this for me quickly?,53,reverted_card_payment?
can i dispute a debit payment that i am seeing that i didn't make from a couple of months ago?,28,direct_debit_payment_not_recognised
i would like to dispute a direct debit transaction,28,direct_debit_payment_not_recognised
"i tried to top up, but it didn't finish.",47,pending_top_up
i thought transfers were free of charge.  i bought something abroad and got charged a ridiculous fee. how do i get this problem fixed.,64,transfer_fee_charged
can i stop a transaction?,8,cancel_transfer
how much longer until i get my new card?,11,card_arrival
whats wrong with my currency exchange?,76,wrong_exchange_rate_for_cash_withdrawal
"i just took some cash out of a cash machine in heathrow airport because i wanted to buy some new sunglasses for my holiday but you've added a fee to the withdrawal, what is this?",19,cash_withdrawal_charge
what happened! i asked for 30 pounds at your atm and only go 10. the machine lied about it too. it said i received the full 30 pounds. someone better help me asap on this.,75,wrong_amount_of_cash_received
i have two of the same charges on my account!,63,transaction_charged_twice
why is there a 1 euro fee on my statement?,34,extra_charge_on_statement
i want a refund for my item,52,request_refund
could you inform me as to why i have been charged a higher fee for doing banking abroad.,64,transfer_fee_charged
what was the cause for my card to be declined?,26,declined_cash_withdrawal
i was wondering if international transfers take longer than normal because i made a transfer from france a couple of days ago and nothing has happened yet?,5,balance_not_updated_after_bank_transfer
i have an odd payment in my statement,16,card_payment_not_recognised
my transfer seems to be too expensive.,64,transfer_fee_charged
can i return an item?,52,request_refund
why was i charged an extra fee when doing a transfer?,64,transfer_fee_charged
where is my missing cheque i deposited?,6,balance_not_updated_after_cheque_or_cash_deposit
why hasnt my top up gone through yet?? i thought it was suppose to be instant? am i wrong? why is it still pending?,47,pending_top_up
why am i not seeing the check i deposited this morning in my account?,6,balance_not_updated_after_cheque_or_cash_deposit
i noticed that there was an extra charge fee on my account. could you explain to me why?,64,transfer_fee_charged
why is my transfer taking so long to complete?,66,transfer_not_received_by_recipient
i did not get any money but still was charged,75,wrong_amount_of_cash_received
hello i have a uk account.  can you please check if everything is alright with it?  i made a transfer a couple hours ago but it doesn't show up yet.,5,balance_not_updated_after_bank_transfer
i have a charge i did not make.,16,card_payment_not_recognised
what do i need to do to cancel a transaction?,8,cancel_transfer
why couldn't i transfer funds to my beneficiary?,7,beneficiary_not_allowed
i am inquiring about why there was an extra fee charged when i used an atm.,19,cash_withdrawal_charge
why haven't i gotten my payment yet?,45,pending_card_payment
there is a direct debit fee in the app that i didn't do.,28,direct_debit_payment_not_recognised
i havent got my card,11,card_arrival
why did i get charged twice for the same thing,63,transaction_charged_twice
i bought something that i need a refund for.,52,request_refund
why has a transaction to a friend been delayed?,66,transfer_not_received_by_recipient
i hope you can help me. my account has been compromised from a different town that i haven't been to. can you please place a hold on my account until i can make it to the bank?,20,cash_withdrawal_not_recognised
my identity has been stolen. i still have my physical card but there are charges i didn't make on my account. how do i cancel this card or dispute the charges?,20,cash_withdrawal_not_recognised
do cash withdrawals cost anything?,19,cash_withdrawal_charge
the atm didn't give me enough money.,75,wrong_amount_of_cash_received
i have cash deposit to my account but it is experiencing a problem,6,balance_not_updated_after_cheque_or_cash_deposit
please help me.  i am still waiting on a refund.,51,Refund_not_showing_up
i use my card internationally to manage payments and i just noticed that you are adding additional fees.  why?  i am a good customer and this has me thinking about leaving.,64,transfer_fee_charged
what is the dollar that i have pending on my statement there?,34,extra_charge_on_statement
"i tried using a check to update my balance, but it isn't work? is something wrong?",6,balance_not_updated_after_cheque_or_cash_deposit
how can i get a refund for an item i purchased but has not yet arrived?,52,request_refund
"i was abroad and needed some cash, but i think the wrong exchange rate was applied to the transaction.",76,wrong_exchange_rate_for_cash_withdrawal
why is my beneficiary not allowed?,7,beneficiary_not_allowed
what happens when i am charged twice?,63,transaction_charged_twice
i would like to track the card you sent to me.,11,card_arrival
why have i been charged an extra £1?,34,extra_charge_on_statement
where is my recent refund in the my statement?,51,Refund_not_showing_up
how can i make my card active?,0,activate_my_card
"i only received $20, but i requested $100.",75,wrong_amount_of_cash_received
i have duplicated transactions on my statement,63,transaction_charged_twice
there is a payment showing that i know i didn't make. i didn't use my card that day and i'm sure of it. can you please cancel that transaction and return my money? thankyou,28,direct_debit_payment_not_recognised
i want to activate my new card.,0,activate_my_card
"i deposited a check, but haven't received the funds for it.",6,balance_not_updated_after_cheque_or_cash_deposit
i think someone stole money from my card,20,cash_withdrawal_not_recognised
help! i just realised someone has apparently withdrawn money using my card! it's from some odd remote town where i definitely haven't been. please freeze it immediately!,20,cash_withdrawal_not_recognised
can you tell me why the card payment came back?,53,reverted_card_payment?
please tell me how the exchange rate is determined. i was expecting more money for the transaction.,76,wrong_exchange_rate_for_cash_withdrawal
i need to cancel a transaction.,8,cancel_transfer
i noticed that i got charged extra for using the card.,15,card_payment_fee_charged
one of my card payments looks like it's stuck but i have made the payment days ago. how long until the payment will be applied to my account?,45,pending_card_payment
why was i charged an extra fee from the atm?,19,cash_withdrawal_charge
"i have done a transfer within the country the day before yesterday, but it's still not there yet. can you please check what's going on with that, the account number definitely is the right one, i've checked that already.",66,transfer_not_received_by_recipient
"i made a transfer and according to the receiver ""they haven't received the right amount"" its lesser than it should be.now i have to transfer more money to make up for the missing amount . can you please help me about this, what should be done ?",64,transfer_fee_charged
my check or cash deposit has not shown up,6,balance_not_updated_after_cheque_or_cash_deposit
i would like to be assisted with the activation of my card.,0,activate_my_card
i had the wrong exchange rate applied to some cash i got abroad.,76,wrong_exchange_rate_for_cash_withdrawal
why is my transfer taking so long. i thought it was supposed to only take 1 day if i made a transfer to someone. can you wee what went wrong?,66,transfer_not_received_by_recipient
i bought something and i take issue with the exchange rate applied.,17,card_payment_wrong_exchange_rate
how do i turn on my new card?,0,activate_my_card
why have i been charged for pulling cash out of my own account?,19,cash_withdrawal_charge
"i took out cash from the atm, but something must have went wrong, my account shows the correct amount of cash i took out, but the atm didn't give me that amount. how do i get my money back?",75,wrong_amount_of_cash_received
why is a transfer to a beneficiary not possible?,7,beneficiary_not_allowed
im going to need to make a transfer from a uk account but i need it to go through asap. is that going to be possible or will it take forever?? im hoping it will be a couple hours and not a couple weeks.,5,balance_not_updated_after_bank_transfer
why hasn't payment gone through yet?,45,pending_card_payment
does the card you sent have a tracking number?,11,card_arrival
please explain the fee on a transfer i made.,64,transfer_fee_charged
i need to move money to another beneficiary. why is it not working?,7,beneficiary_not_allowed
i am having trouble activating my card.,0,activate_my_card
"help, i see money missing i didn't take out.",20,cash_withdrawal_not_recognised
i couldn't pay with my card,25,declined_card_payment
why does my transaction have an added fee?,34,extra_charge_on_statement
what is going on with my cash deposit. i'm looking at my account balance and it is not there. it has been almost a week. someone better get back to me asap.,6,balance_not_updated_after_cheque_or_cash_deposit
my rate of exchange was wrong.,17,card_payment_wrong_exchange_rate
there's an unauthorized cash withdraw,20,cash_withdrawal_not_recognised
what's taking my top-up so long?,47,pending_top_up
why was my account assessed a fee?,34,extra_charge_on_statement
is there a way to track the delivery of my card?,11,card_arrival
i didn't set up the direct debit i have,28,direct_debit_payment_not_recognised
