text,label,label_text
i am not recognizing a debit payment from my account.,28,direct_debit_payment_not_recognised
could you explain your rules for atm fees?,19,cash_withdrawal_charge
i have a payment i didnt make on my account,16,card_payment_not_recognised
"my top up has been pending for an hour already, and i really need this to go through as soon as possible.  can you help?",47,pending_top_up
why can't a beneficiary receive a money transfer from me?,7,beneficiary_not_allowed
my account seems a bit off and getting weird charges.,63,transaction_charged_twice
my wallet was taken and i see that someone is using my card!   please help me!,20,cash_withdrawal_not_recognised
why did i only get 20.00,75,wrong_amount_of_cash_received
i tried to used my card in a shop and the transaction was declined.,25,declined_card_payment
"if i see a payment in the app that i don't recognize, what should i do?",16,card_payment_not_recognised
i believe i was charged for making a withdrawal after i went grocery shopping. are you guys charging for this now?,19,cash_withdrawal_charge
my wallet got stolen a couple hours ago and now i've seen there already is a withdrawal. help this is absolutely urgent i don't want to loose more money,20,cash_withdrawal_not_recognised
should my top-up be completed by now?,47,pending_top_up
i don't know where a direct debit payment came from,28,direct_debit_payment_not_recognised
what's going on with my balance? shouldn't it be a bit higher since i deposited a cheque a day ago?,6,balance_not_updated_after_cheque_or_cash_deposit
"i made a payment a while ago and it is still showing as ""pending"" in the account. how long will this payment take to complete?",45,pending_card_payment
is it normal to be charged an extra fee when paying with my card?,15,card_payment_fee_charged
balance is not up to date.,5,balance_not_updated_after_bank_transfer
why do i get a fee every time i transfer?,64,transfer_fee_charged
why was i charged a fee for my card payment?,15,card_payment_fee_charged
a withdraw i tried to make at the atm was declined i don't know why.,26,declined_cash_withdrawal
my cash deposit hasn't posted to my account.,6,balance_not_updated_after_cheque_or_cash_deposit
i am seeing a direct debit i wasn't aware of.,28,direct_debit_payment_not_recognised
why is the payment on my card still pending?,45,pending_card_payment
how come my card payment is still pending?,45,pending_card_payment
"what's go on, where is my new card?",11,card_arrival
why wouldn't the atm give me cash?,26,declined_cash_withdrawal
why is there an extra fee charged?,34,extra_charge_on_statement
hi something is going on with the app.  i see some payments i didn't make?,16,card_payment_not_recognised
i have just read my statement and there is a payment i don't recognise.,16,card_payment_not_recognised
can you tell me if i can track the card you sent me?,11,card_arrival
what's the normal time frame for a transfer from a uk account? after just making a transfer it doesn't appear at all. i need to know if things went okay.,5,balance_not_updated_after_bank_transfer
"in regards to my card payment, the exchange rate is incorrect.",17,card_payment_wrong_exchange_rate
i just bought an item and would like to stop payment can you tell me if the item has been sent yet?,52,request_refund
i've got charges on my account i did not authorize. can i get this money back from the last couple of days that it's been coming out? i also need to freeze my card.,16,card_payment_not_recognised
"i made a big purchase that i regretted and cancelled, the merchant said that my refund was submitted. can you confirm to me that all of my money was truly returned to me?",51,Refund_not_showing_up
why and i being charged this fee?,15,card_payment_fee_charged
my top-up hasn't happened yet.,47,pending_top_up
why is my transaction taking so long to complete?,66,transfer_not_received_by_recipient
why did my cash deposit not show up?,6,balance_not_updated_after_cheque_or_cash_deposit
will you be able to activate my card,0,activate_my_card
i'm pretty sure my top up is still pending.,47,pending_top_up
who charged my card,64,transfer_fee_charged
i need a transfer cancelled.,8,cancel_transfer
i'm unhappy with the exchange rate your cash transactions.,76,wrong_exchange_rate_for_cash_withdrawal
my top up hasn't gone through,47,pending_top_up
my card payment wasn't declined,25,declined_card_payment
how long does it take to show a deposit i made to my balance?,6,balance_not_updated_after_cheque_or_cash_deposit
please tell my why i was charged a fee for using my card?,15,card_payment_fee_charged
i noticed a different charge while i was taking my money out.,19,cash_withdrawal_charge
it says pending status for my payment. why?,45,pending_card_payment
why was an extra charge added when i used my card?,15,card_payment_fee_charged
why was i charged a fee for withdrawing money off my card?,19,cash_withdrawal_charge
i would like to return my purchases,52,request_refund
why are there multiple transactions showing for one purchase?,63,transaction_charged_twice
"how long should a transfer normally take to process completely? i have a friend that needs it right away, but it's already been 2 hours and she hasn't received it.",66,transfer_not_received_by_recipient
i tried doing an in country transfer earlier this week. i thought it would be there by now but i still don't see the money. can you check the status on my transfer?,66,transfer_not_received_by_recipient
"hello, is there any way to double check my card? i have never had issues with withdraws in the past, but this morning on the way to work it was unexpectedly declined.",26,declined_cash_withdrawal
i was checking my account when i saw a $500 cash withdraw that i know i didn't do.  i have my card so i don't understand how this happened.  please help me.,20,cash_withdrawal_not_recognised
"i bought something while traveling, and the exchange rate was wrong.",17,card_payment_wrong_exchange_rate
i just initiated a transfer but i'd like to cancel it.,8,cancel_transfer
the cheque i sent to you to have deposited a couple days ago has not cleared in my account yet. what is the issue?,6,balance_not_updated_after_cheque_or_cash_deposit
do i get charged for withdrawals?,19,cash_withdrawal_charge
"my card payment is just showing up as pending and it has been a while , what's going on with that, it should be going through at some point?",45,pending_card_payment
what does it mean if my payment is pending?,45,pending_card_payment
"how much time do transfers take? i sent money to a friend who needs it fast. it's been hours, and the money has not gone through.",66,transfer_not_received_by_recipient
the card payment didn't work,53,reverted_card_payment?
i see a direct debit transaction in my history that i did not set up.,28,direct_debit_payment_not_recognised
"i just checked and my payment was cancelled, why?",53,reverted_card_payment?
i contacted the seller for a direct refund last week but he still hasn't give me my money. what should i do?,51,Refund_not_showing_up
i dont recognize a charge on my card,16,card_payment_not_recognised
why hasn't arrived yet a transaction i did to my friend?,66,transfer_not_received_by_recipient
what is the proper way to activate a card?,0,activate_my_card
my beneficiary is unable to transact,7,beneficiary_not_allowed
my card isn't letting me purchase something and i wanted to know why.,7,beneficiary_not_allowed
why are you charging me a transfer fee?,64,transfer_fee_charged
why is there a fee when i thought there would be no fees?,15,card_payment_fee_charged
i've changed my mind on an item.  how do i get a refund?,52,request_refund
how long does it take for my payment to process?,45,pending_card_payment
explain the activation method for this card,0,activate_my_card
why is there a fee for using my card?,15,card_payment_fee_charged
i'm on holiday and i noticed a different amount for exchange rate.  can you explain?,17,card_payment_wrong_exchange_rate
i deposited cash into my account and i'm having trouble seeing it on my account.,6,balance_not_updated_after_cheque_or_cash_deposit
why am i not allowed to transfer money to my cryptocurrency exchange?,7,beneficiary_not_allowed
"when i was traveling abroad, the exchange rate was applied wrong.",17,card_payment_wrong_exchange_rate
how can my new card be activated?,0,activate_my_card
why have i been charged an extra pound?,34,extra_charge_on_statement
why would my payment for my card show as pending?,45,pending_card_payment
what do i do if the exchange rate was wrong for the item i bought overseas?,17,card_payment_wrong_exchange_rate
why does my statement show a $1 charge on my account?,34,extra_charge_on_statement
why was my card payment reversed?,53,reverted_card_payment?
when do you charge fees on accounts? i just saw a charge on my statement.,15,card_payment_fee_charged
"is there a fee for making a payment? if so, let me know why.",15,card_payment_fee_charged
i need to be made aware when i am being charged an extra amount for payments please. i looked over the app earlier and noticed an additional feel related to one of the payments. i was not warned about this before.,15,card_payment_fee_charged
"hi need your help for getting the refund or cancel the payment of an item, i have ordered but still have not received it.",52,request_refund
when will my top up be applied?,47,pending_top_up
"i draw out money from your atm during holidays, and was charged insanely. i wouldn't have done it, if i had a little sense about the shocking charges.",76,wrong_exchange_rate_for_cash_withdrawal
i sent money about 5 days ago and the recipient has not received the money yet.,66,transfer_not_received_by_recipient
why can't i use my beneficiary?,7,beneficiary_not_allowed
i bought something this morning and the payment is still pending,45,pending_card_payment
i see a direct debit charge that i did not approve,28,direct_debit_payment_not_recognised
how long does it take for money to transfer?  i sent some to a friend and it hasn't gone through yet.,66,transfer_not_received_by_recipient
i didn't get all the money i asked for,75,wrong_amount_of_cash_received
i did a transfer.  what is the extra fee?,64,transfer_fee_charged
there's a cash withdrawal on my account that i didn't make,20,cash_withdrawal_not_recognised
i got less cash at the atm than i asked for. why?,75,wrong_amount_of_cash_received
i have an unauthorized charge.,28,direct_debit_payment_not_recognised
i just looked over my statement and i don't recognize the name of a card payment.,16,card_payment_not_recognised
i can still see money in my account after making a payment,5,balance_not_updated_after_bank_transfer
i got charged a fee that shouldn't be there from my cash,19,cash_withdrawal_charge
i bought something online a week ago and i never got it in the mail.can i just get my money back now i don't want to keep waiting on something that isn't going to show up.,52,request_refund
i'm worried that my card has been compromised because i see a payment that i didn't make.,16,card_payment_not_recognised
i tried to use the atm today but it would not accept my card.,26,declined_cash_withdrawal
please check the exchange rate for my payment last saturday. i believe i have been overcharged.,17,card_payment_wrong_exchange_rate
i just checked my account on the app and there is a payment on there that i did not make.,16,card_payment_not_recognised
i am confused about your fee structure and was disappointed to see a fee for my transfer.,64,transfer_fee_charged
why has transferring money resulted in a charge?,64,transfer_fee_charged
a payment in my account was made by someone i don't know,16,card_payment_not_recognised
there are two of the same charge on my statement.,63,transaction_charged_twice
why am i being charged for withdrawing cash but haven't in the past?,19,cash_withdrawal_charge
how long should i wait for top up go go through ?,47,pending_top_up
i did a transfer and i was charged a fee that shouldn't be there!,64,transfer_fee_charged
"i was out today looking forward to paying with my new card, turns out the payment kept getting declined. this is really sad, what's going on?",25,declined_card_payment
"i made a deposit a couple of days back it's, as of yet, not gone in! it would be ideal if you assist me with this",6,balance_not_updated_after_cheque_or_cash_deposit
my app is showing a cash balance that i did not receive.,20,cash_withdrawal_not_recognised
atm withdrawal not working.,26,declined_cash_withdrawal
why hasn't the transaction i did to my friend arrive yet?,66,transfer_not_received_by_recipient
do you know the reason why my card payment was declined?,25,declined_card_payment
why is the exchange rate terrible?  that can't be close to the actual interbank rate.,17,card_payment_wrong_exchange_rate
i'm waiting for my transaction to complete.,66,transfer_not_received_by_recipient
how do i dispute a direct debit on my account?,28,direct_debit_payment_not_recognised
maximum how many days get the courier?,11,card_arrival
why did you charge me a fee when i made a transfer?,64,transfer_fee_charged
there is money in my account that i didnt put there,20,cash_withdrawal_not_recognised
what do i need for activation of my card?,0,activate_my_card
do i need a photo id to activate a my new card?,0,activate_my_card
why hasn't my payment gone through yet?,45,pending_card_payment
i could not get the atm to work,26,declined_cash_withdrawal
i was charged an extra pound for no reason. why is that?,34,extra_charge_on_statement
how long does it take for the transfer to go through?,66,transfer_not_received_by_recipient
is it possible to use an atm when i am not in the country and make a withdraw with out extra fees?,76,wrong_exchange_rate_for_cash_withdrawal
"i've got a problem - i bought something with my card one or two weeks ago, but now exact same amount of the purchase is showing up in my account. i like more money in my account, but this is too good to be true. can you tell me what's happening?",53,reverted_card_payment?
was my card payment reverted?,53,reverted_card_payment?
my card didn't go through.  it doesn't make sense.  you told me that everything was ok.,25,declined_card_payment
the atm wouldn't give out cash,26,declined_cash_withdrawal
i thought i would have received my new card at this point.,11,card_arrival
when will my transfer process?,5,balance_not_updated_after_bank_transfer
i did a money transaction and dont have a receipt,66,transfer_not_received_by_recipient
why has my top up not gone through yet?,47,pending_top_up
is there a way to track the new card you sent me?,11,card_arrival
looking back on my transactions from a couple of months ago i have noticed a charge that is fairly large that i'm certain was not completed by me. i know it has been a while but can i please dispute this charge?,28,direct_debit_payment_not_recognised
"i decided i no long want something that i ordered, and want a refund. how do i go about doing that?",52,request_refund
my payment is taking a long time to go through.,45,pending_card_payment
my friend has not got the money i sent last week.,66,transfer_not_received_by_recipient
do you have info about the card on delivery?,11,card_arrival
i ordered my card but it still isn't here,11,card_arrival
why is my payment declined? it looked like everything worked ok and my account was fine.,25,declined_card_payment
am i charged a fee to transfer funds?,64,transfer_fee_charged
i need to actuate my card.,0,activate_my_card
can you assist me in activating my card?,0,activate_my_card
i am inquiring about a $1 charge on my statement.,34,extra_charge_on_statement
i deposited money but my balance hasn't been updated yet.,6,balance_not_updated_after_cheque_or_cash_deposit
why was i charged when taking out money?,19,cash_withdrawal_charge
i keep checking my statements but nothing shows up! i requested a refund a long time ago but seems it's not reaching my account for some reason. can you please help me get the money back from the seller for me,51,Refund_not_showing_up
"i have moved to a new house and set up a rent payment to my landlord, it was supposed to be in her account a few days ago but it hasn't arrived.  i definitely sent it to the right place, can you confirm where the money is?",66,transfer_not_received_by_recipient
why is there a service fee on my statement?,34,extra_charge_on_statement
i just got my card and cannot get it to work.,0,activate_my_card
"i withdrew money from an atm today, and now my account is showing a different amount than what i withdrew. i checked the amount the atm gave me, and it looks like it gave me the wrong amount of money. what is the best thin for me to do to get this fixed?",75,wrong_amount_of_cash_received
my money hasn't been transferred yet.,5,balance_not_updated_after_bank_transfer
after making a payment with my card it doesn't seem to have worked. it's just showing to be pending. when will this actually be going through?,45,pending_card_payment
i exchanged russian rubles for british pounds today and got less than i expected. was exchange rate correct?,17,card_payment_wrong_exchange_rate
just today there was a purchase on my card that wasn't done by me. can this be reversed and my card be frozen? i can't have this continue!,16,card_payment_not_recognised
why am i unable to transfer money when i was able to before?,7,beneficiary_not_allowed
what was the $1 fee i got,34,extra_charge_on_statement
does the fee for exchange change?,17,card_payment_wrong_exchange_rate
why haven't i received a refund yet?,51,Refund_not_showing_up
i tried to withdraw 50 pounds but it only gave me 30. where is the rest of my money?,75,wrong_amount_of_cash_received
"i made a transfer and the receiver said an amount was received, but not exactly the same as the right amount. i now have to transfer more to get the remainder to the receiver. can you alert me about this. what's been happening?",64,transfer_fee_charged
my foreign currency exchange has been applied incorrectly.,17,card_payment_wrong_exchange_rate
why did my payment go back to my account when i bought something?,53,reverted_card_payment?
seems like my card payment has been cancelled,53,reverted_card_payment?
how long do transfers take to go though,5,balance_not_updated_after_bank_transfer
"hello, i have noticed a problem on my recent withdrawal at the banks atm machine.  i made a transaction and upon receiving my funds from the machine, a fee was assessed to my withdrawal.  are these types of transactions free of charge?",19,cash_withdrawal_charge
why can't the person i sent the money transfer to see it?,66,transfer_not_received_by_recipient
"according to the app, i got cash from an atm but i haven't made any transactions.",20,cash_withdrawal_not_recognised
i was not given the amount of cash i withdrew,75,wrong_amount_of_cash_received
how do you figure out the exchange rate? can you explain why i got less money than expected?,76,wrong_exchange_rate_for_cash_withdrawal
why was my transfer charged a fee?,64,transfer_fee_charged
there was a fee charged when i paid with my card.,15,card_payment_fee_charged
i received duplicate charges.,63,transaction_charged_twice
when will my top-up go through?,47,pending_top_up
is there a place to check for fee for payments? i feel like i'm getting charged too much at times.,15,card_payment_fee_charged
the transfer to my beneficiary has not gone through,7,beneficiary_not_allowed
duplicate transactions appear on my account,63,transaction_charged_twice
i didn't cancel my card payment.,53,reverted_card_payment?
where is my credit card that was to be mailed?,11,card_arrival
i could not access my money at the atm,26,declined_cash_withdrawal
"can i get money in my home currency at some atm? i'm on holiday and am a bit concerned because i don't have any cash with me, it is possible to withdraw here already without any additional cost?",76,wrong_exchange_rate_for_cash_withdrawal
a payment on my statement is wrong.,16,card_payment_not_recognised
i saw a fee on my receipt from withdrawing money while shopping earlier.  is there supposed to be a fee for this type of transaction?,19,cash_withdrawal_charge
"i deposited some money, but the balance has not changed.",6,balance_not_updated_after_cheque_or_cash_deposit
"a transaction i did to my friend hasn't arrived yet, why?",66,transfer_not_received_by_recipient
is my card payment reverted?,53,reverted_card_payment?
there is money missing from my account.,20,cash_withdrawal_not_recognised
the exchange rate for my cash withdrawal was incorrect,76,wrong_exchange_rate_for_cash_withdrawal
what is this cash withdrawal i don't recognize?,20,cash_withdrawal_not_recognised
my payment has not been accepted.,53,reverted_card_payment?
is the fee with my cash withdrawal a mistake?,19,cash_withdrawal_charge
why am i being charged for transferring money?,64,transfer_fee_charged
i lost my wallet and i think someone is withdrawing cash with my card. please help. it is urgent.,20,cash_withdrawal_not_recognised
i just saw a fee on my account. when do these get charged?,15,card_payment_fee_charged
the exchange rate was wrong?,76,wrong_exchange_rate_for_cash_withdrawal
"i traded some of my money from my native country into an atm to exchange for foreign currency, and the money i received was a different equating amount!",76,wrong_exchange_rate_for_cash_withdrawal
"i noticed my card payment was cancelled, can you tell me why?",53,reverted_card_payment?
i want to know about your refund policy.,52,request_refund
i was just going over my transactions for the past couple of months and noticed a large type charge that i know i did not make. even though it's been a while can i please still dispute this?,28,direct_debit_payment_not_recognised
i have a transaction and would like to know if i it's cancelable?,8,cancel_transfer
how do i reverse a transaction on my account?,52,request_refund
could you please tell me why my purchases from this morning say payment is pending?,45,pending_card_payment
"i did a payment with my card but seem that didn't work, it's still listed as pending since a while ago. when does this actually go through?",45,pending_card_payment
why are my payments not working and show pending?,45,pending_card_payment
why isn't the transferred money there?,5,balance_not_updated_after_bank_transfer
i was charged and shouldn't have been charged when using my card!,15,card_payment_fee_charged
my atm transaction was cancelled.,26,declined_cash_withdrawal
says that my top-up is incomplete?,47,pending_top_up
my payment card was declined - could you tell me why?,25,declined_card_payment
why is there a fee added to my statement?,34,extra_charge_on_statement
"help! i think someone has a copy of my card - i still have my card, but a five hundred pound cash withdrawal that i didn't authorize is shown on my account.",20,cash_withdrawal_not_recognised
when do i get charged a fee for using the card?,15,card_payment_fee_charged
why would my card payment get reverted?,53,reverted_card_payment?
it is common for an international transfer to take 2 days or longer? i made a transfer from france 2 days ago and i have not seen it yet.,5,balance_not_updated_after_bank_transfer
why has my card payment been reversed?,53,reverted_card_payment?
why was i not able to get cash from the atm?,26,declined_cash_withdrawal
a payment i made is for a wrong amount can you help me correct the mistake.,8,cancel_transfer
i would like to cancel my order.,52,request_refund
"i've use this account all the time, including over this past month, to pay for things from my new place abroad. i'm a really good customer, so why do i suddenly have new fees? i should be rewarded instead of charged more fees.",64,transfer_fee_charged
"i think i was charged twice, please help!",63,transaction_charged_twice
why is there an extra pound charge that is pending?,34,extra_charge_on_statement
how can my new card be renewed?,0,activate_my_card
there is  a charge i don't recognize.,16,card_payment_not_recognised
i think something went wrong with my exchange between russian ruble and uk pounds. i was overcharged during the swap.,17,card_payment_wrong_exchange_rate
why did i not get my refund yet?,51,Refund_not_showing_up
what are the fees imposed when i make a transaction?,15,card_payment_fee_charged
why can't i transfer to an account?,7,beneficiary_not_allowed
i wasn't able to do a transfer to an account,7,beneficiary_not_allowed
i'm still waiting for my card that was issued a week ago. what should i do?,11,card_arrival
why has my card been declined?  whats the deal?,25,declined_card_payment
i am still waiting on my bank transfer,5,balance_not_updated_after_bank_transfer
i withdrew cash and was charged. why?,19,cash_withdrawal_charge
there is a card payment i'm not familiar with.,16,card_payment_not_recognised
why i'm i being charged an extra pound,34,extra_charge_on_statement
the app shows a withdrawal that i did not make or authorize.,20,cash_withdrawal_not_recognised
an item i bought had the wrong exchange rate applied.,17,card_payment_wrong_exchange_rate
"i am getting an error stating my transfer is not possible while transferring money. let me know the issue as its the first time i am getting error, earlier it used to work.",7,beneficiary_not_allowed
the card payment is declined.  please inform me why.,25,declined_card_payment
an extra pound was charged!,34,extra_charge_on_statement
"how long is a top up supposed to be pending, because an hour is too long! can you fix this to go through?",47,pending_top_up
"i made a transfer and the receiver did not get the right amount its lesser than what it should be,now i have to transfer more money to make up for the missing amount . can you please help me about this, what should be done",64,transfer_fee_charged
why is my payment still pending?,45,pending_card_payment
i'm trying to take money from my account but its not letting me. help!,26,declined_cash_withdrawal
